"Welcome to address book system in mysql database"

UC1 -> Create a database for address book service
---------------------------------------------------------
mysql> create database address_book_service;
Query OK, 1 row affected (0.14 sec)

mysql> show databases;
+----------------------+
| Database             |
+----------------------+
| address_book_service |
| information_schema   |
| mysql                |
| performance_schema   |
| sys                  |
+----------------------+
5 rows in set (0.01 sec)
--------------------------------------------------------------------------
UC2 -> Create a table with various fields in address book service database
--------------------------------------------------------------------------
mysql> use address_book_service;
Database changed

mysql> create table address_book
    -> (FirstName varchar(20) not null,
    -> LastName varchar(20) not null,
    -> Address varchar(100) not null,
    -> City varchar(30) not null,
    -> State varchar(30) not null,
    -> Email varchar(30) not null,
    -> ZipCode int not null,
    -> PhoneNumber int not null);
Query OK, 0 rows affected (0.47 sec)

mysql> describe address_book;
+-------------+--------------+------+-----+---------+-------+
| Field       | Type         | Null | Key | Default | Extra |
+-------------+--------------+------+-----+---------+-------+
| FirstName   | varchar(20)  | NO   |     | NULL    |       |
| LastName    | varchar(20)  | NO   |     | NULL    |       |
| Address     | varchar(100) | NO   |     | NULL    |       |
| City        | varchar(30)  | NO   |     | NULL    |       |
| State       | varchar(30)  | NO   |     | NULL    |       |
| Email       | varchar(30)  | NO   |     | NULL    |       |
| ZipCode     | int          | NO   |     | NULL    |       |
| PhoneNumber | int          | NO   |     | NULL    |       |
+-------------+--------------+------+-----+---------+-------+
8 rows in set (0.12 sec)

-------------------------------------------------------------------------
UC3 -> Inserting values into a table
-------------------------------------------------------------------------

mysql> insert into address_book(FirstName,LastName,Address,City,State,Email,ZipCode,PhoneNumber)values
    -> ('Annu','Kumari','Gurgaon','Gurgaon','Haryana','annusinghraj1998@gmail.com',122002,70032654),
    -> ('Rajni','Singh','Patna','Patna','Bihar','choti@gmail.com',851128,90032456),
    -> ('Garima','Jain','Ajmer','Ajmer','Rajasthan','garima12@gmail.com',851120,70032459);
Query OK, 3 rows affected (0.03 sec)
Records: 3  Duplicates: 0  Warnings: 0

mysql> select * from address_book;
+-----------+----------+---------+---------+-----------+----------------------------+---------+-------------+
| FirstName | LastName | Address | City    | State     | Email                      | ZipCode | PhoneNumber |
+-----------+----------+---------+---------+-----------+----------------------------+---------+-------------+
| Annu      | Kumari   | Gurgaon | Gurgaon | Haryana   | annusinghraj1998@gmail.com |  122002 |    70032654 |
| Rajni     | Singh    | Patna   | Patna   | Bihar     | choti@gmail.com            |  851128 |    90032456 |
| Garima    | Jain     | Ajmer   | Ajmer   | Rajasthan | garima12@gmail.com         |  851120 |    70032459 |
+-----------+----------+---------+---------+-----------+----------------------------+---------+-------------+
3 rows in set (0.01 sec)

-----------------------------------------------------------------------------------------------------
UC4 -> Edit existing Contact with using their name
-----------------------------------------------------------------------------------------------------

mysql> update address_book set Address = 'Bijaynagar' where FirstName = 'Garima';
Query OK, 1 row affected (0.02 sec)
Rows matched: 1  Changed: 1  Warnings: 0

mysql> select * from address_book;
+-----------+----------+------------+---------+-----------+----------------------------+---------+-------------+
| FirstName | LastName | Address    | City    | State     | Email                      | ZipCode | PhoneNumber |
+-----------+----------+------------+---------+-----------+----------------------------+---------+-------------+
| Annu      | Kumari   | Gurgaon    | Gurgaon | Haryana   | annusinghraj1998@gmail.com |  122002 |    70032654 |
| Rajni     | Singh    | Patna      | Patna   | Bihar     | choti@gmail.com            |  851128 |    90032456 |
| Garima    | Jain     | Bijaynagar | Ajmer   | Rajasthan | garima12@gmail.com         |  851120 |    70032459 |
+-----------+----------+------------+---------+-----------+----------------------------+---------+-------------+
3 rows in set (0.00 sec)

------------------------------------------------------------------------------------------------------
UC5 -> Delete contact with using person name
------------------------------------------------------------------------------------------------------

mysql> select * from address_book;
+-----------+----------+------------+---------+-----------+----------------------------+---------+-------------+
| FirstName | LastName | Address    | City    | State     | Email                      | ZipCode | PhoneNumber |
+-----------+----------+------------+---------+-----------+----------------------------+---------+-------------+
| Annu      | Kumari   | Gurgaon    | Gurgaon | Haryana   | annusinghraj1998@gmail.com |  122002 |    70032654 |
| Rajni     | Singh    | Patna      | Patna   | Bihar     | choti@gmail.com            |  851128 |    90032456 |
| Garima    | Jain     | Bijaynagar | Ajmer   | Rajasthan | garima12@gmail.com         |  851120 |    70032459 |
+-----------+----------+------------+---------+-----------+----------------------------+---------+-------------+

mysql> delete from address_book where FirstName = 'Rajni';
Query OK, 1 row affected (0.01 sec)

mysql> select * from address_book;
+-----------+----------+------------+---------+-----------+----------------------------+---------+-------------+
| FirstName | LastName | Address    | City    | State     | Email                      | ZipCode | PhoneNumber |
+-----------+----------+------------+---------+-----------+----------------------------+---------+-------------+
| Annu      | Kumari   | Gurgaon    | Gurgaon | Haryana   | annusinghraj1998@gmail.com |  122002 |    70032654 |
| Garima    | Jain     | Bijaynagar | Ajmer   | Rajasthan | garima12@gmail.com         |  851120 |    70032459 |
+-----------+----------+------------+---------+-----------+----------------------------+---------+-------------+
2 rows in set (0.00 sec)

----------------------------------------------------------------------------------------
UC6 -> Ability to retrieve the contact belonging to their city or state
----------------------------------------------------------------------------------------

mysql> select * from address_book where City = 'Gurgaon';
+-----------+----------+---------+---------+---------+----------------------------+---------+-------------+
| FirstName | LastName | Address | City    | State   | Email                      | ZipCode | PhoneNumber |
+-----------+----------+---------+---------+---------+----------------------------+---------+-------------+
| Annu      | Kumari   | Gurgaon | Gurgaon | Haryana | annusinghraj1998@gmail.com |  122002 |    70032654 |
+-----------+----------+---------+---------+---------+----------------------------+---------+-------------+
1 row in set (0.00 sec)

mysql> select * from address_book where City = 'Ajmer' or State ='Rajasthan';
+-----------+----------+------------+-------+-----------+--------------------+---------+-------------+
| FirstName | LastName | Address    | City  | State     | Email              | ZipCode | PhoneNumber |
+-----------+----------+------------+-------+-----------+--------------------+---------+-------------+
| Garima    | Jain     | Bijaynagar | Ajmer | Rajasthan | garima12@gmail.com |  851120 |    70032459 |
+-----------+----------+------------+-------+-----------+--------------------+---------+-------------+
1 row in set (0.00 sec)

mysql> select * from address_book where City = 'Gurgaon' or State ='Rajasthan';
+-----------+----------+------------+---------+-----------+----------------------------+---------+-------------+
| FirstName | LastName | Address    | City    | State     | Email                      | ZipCode | PhoneNumber |
+-----------+----------+------------+---------+-----------+----------------------------+---------+-------------+
| Annu      | Kumari   | Gurgaon    | Gurgaon | Haryana   | annusinghraj1998@gmail.com |  122002 |    70032654 |
| Garima    | Jain     | Bijaynagar | Ajmer   | Rajasthan | garima12@gmail.com         |  851120 |    70032459 |
+-----------+----------+------------+---------+-----------+----------------------------+---------+-------------+
2 rows in set (0.00 sec)

---------------------------------------------------------------------------
UC7 -> Size of the address book by city and state
---------------------------------------------------------------------------

mysql> select count(City) from address_book;
+-------------+
| count(City) |
+-------------+
|           2 |
+-------------+
1 row in set (0.05 sec)

mysql> select count(State) from address_book;
+--------------+
| count(State) |
+--------------+
|            2 |
+--------------+
1 row in set (0.00 sec)

